{
  "$schema": "https://json-schema.org/draft/2020-12/schema",
  "$id": "defense-factory://patch-preparation/patches.schema.json",
  "title": "Defense Factory stage 4 patch-preparation record (patches.json)",
  "description": "Written by the agent, normalized by normalize_patches.py (which adds id and orders the patches by priority), checked by check_patches.py (which recomputes the outcome rules and confirms the stage 3b link), and rendered to patches.md by render_patches.py. Every patch is prepared in a disposable container; the diff is recorded, never applied to the target tree.",
  "type": "object",
  "properties": {
    "record": {
      "$ref": "#/$defs/record"
    },
    "validated_record": {
      "$ref": "#/$defs/fileRef"
    },
    "threat_model": {
      "description": "The stage 1 model carried through stage 3b; null when stage 2 was a narrow scan.",
      "anyOf": [
        {
          "type": "null"
        },
        {
          "$ref": "#/$defs/fileRef"
        }
      ]
    },
    "security_guidance": {
      "description": "The resolved security policy from the stage 2 run; null when none was saved.",
      "anyOf": [
        {
          "type": "null"
        },
        {
          "$ref": "#/$defs/fileRef"
        }
      ]
    },
    "environment": {
      "description": "The disposable container the patches were built and tested in; null only for a blocked run.",
      "anyOf": [
        {
          "type": "null"
        },
        {
          "$ref": "#/$defs/environment"
        }
      ]
    },
    "patches": {
      "type": "array",
      "items": {
        "$ref": "#/$defs/patch"
      }
    },
    "not_eligible": {
      "type": "array",
      "items": {
        "$ref": "#/$defs/notEligible"
      }
    },
    "open_questions": {
      "$ref": "#/$defs/textList"
    }
  },
  "required": [
    "record",
    "validated_record",
    "threat_model",
    "security_guidance",
    "environment",
    "patches",
    "not_eligible",
    "open_questions"
  ],
  "additionalProperties": false,
  "$defs": {
    "text": {
      "type": "string",
      "pattern": "\\S"
    },
    "textList": {
      "type": "array",
      "items": {
        "$ref": "#/$defs/text"
      }
    },
    "boolean": {
      "enum": [
        true,
        false
      ]
    },
    "fileRef": {
      "type": "object",
      "properties": {
        "path": {
          "type": "string",
          "pattern": "\\S",
          "description": "Relative to the folder holding patches.json."
        },
        "sha256": {
          "type": "string",
          "pattern": "^[0-9a-f]{64}$"
        },
        "run_id": {
          "type": "string",
          "pattern": "^[A-Za-z0-9._-]+$"
        }
      },
      "required": [
        "path",
        "sha256"
      ],
      "additionalProperties": false
    },
    "location": {
      "type": "object",
      "properties": {
        "path": {
          "type": "string",
          "pattern": "\\S"
        },
        "start_line": {
          "type": "integer",
          "minimum": 1
        },
        "end_line": {
          "type": "integer",
          "minimum": 1
        },
        "role": {
          "enum": [
            "entrypoint",
            "source",
            "root_control",
            "sink",
            "concrete_implementation",
            "evidence"
          ]
        }
      },
      "required": [
        "path",
        "start_line",
        "end_line",
        "role"
      ],
      "additionalProperties": false
    },
    "environment": {
      "type": "object",
      "properties": {
        "host_os": {
          "$ref": "#/$defs/text"
        },
        "host_arch": {
          "$ref": "#/$defs/text"
        },
        "engine": {
          "const": "docker"
        },
        "engine_version": {
          "$ref": "#/$defs/text"
        },
        "base_image": {
          "$ref": "#/$defs/text"
        },
        "base_image_digest": {
          "$ref": "#/$defs/text"
        },
        "emulation": {
          "$ref": "#/$defs/text"
        },
        "code_source": {
          "type": "string",
          "pattern": "^(git-archive:.+|copied-files)$"
        },
        "limits": {
          "type": "object",
          "properties": {
            "memory": {
              "$ref": "#/$defs/text"
            },
            "cpus": {
              "$ref": "#/$defs/text"
            },
            "pids": {
              "type": "integer",
              "minimum": 1
            },
            "timeout_seconds": {
              "type": "integer",
              "minimum": 1
            }
          },
          "required": [
            "memory",
            "cpus",
            "pids",
            "timeout_seconds"
          ],
          "additionalProperties": false
        },
        "network_setup": {
          "enum": [
            "on",
            "off",
            "internal-only"
          ]
        },
        "network_testing": {
          "enum": [
            "on",
            "off",
            "internal-only"
          ]
        },
        "cleanup": {
          "type": "object",
          "properties": {
            "label": {
              "$ref": "#/$defs/text"
            },
            "removed": {
              "type": "object",
              "properties": {
                "containers": {
                  "type": "integer",
                  "minimum": 0
                },
                "images": {
                  "type": "integer",
                  "minimum": 0
                },
                "volumes": {
                  "type": "integer",
                  "minimum": 0
                },
                "networks": {
                  "type": "integer",
                  "minimum": 0
                }
              },
              "required": [
                "containers",
                "images",
                "volumes",
                "networks"
              ],
              "additionalProperties": false
            },
            "remaining": {
              "type": "integer",
              "minimum": 0
            }
          },
          "required": [
            "label",
            "removed",
            "remaining"
          ],
          "additionalProperties": false
        }
      },
      "required": [
        "host_os",
        "host_arch",
        "engine",
        "engine_version",
        "base_image",
        "base_image_digest",
        "emulation",
        "code_source",
        "limits",
        "network_setup",
        "network_testing",
        "cleanup"
      ],
      "additionalProperties": false
    },
    "record": {
      "type": "object",
      "properties": {
        "record_version": {
          "const": 1
        },
        "stage": {
          "const": "4-patch-preparation"
        },
        "status": {
          "enum": [
            "complete",
            "inconclusive",
            "blocked"
          ]
        },
        "run_id": {
          "type": "string",
          "pattern": "^[A-Za-z0-9._-]+$"
        },
        "timestamp": {
          "type": "string",
          "pattern": "^\\d{4}-\\d{2}-\\d{2}T\\d{2}:\\d{2}:\\d{2}Z$"
        },
        "actor": {
          "$ref": "#/$defs/text"
        },
        "model": {
          "$ref": "#/$defs/text"
        },
        "skill_version": {
          "type": "string",
          "pattern": "^patch-preparation/sha256:[0-9a-f]{16}$"
        },
        "target_id": {
          "$ref": "#/$defs/text"
        },
        "target_kind": {
          "enum": [
            "git_revision",
            "git_worktree",
            "directory_snapshot"
          ]
        },
        "version": {
          "$ref": "#/$defs/text"
        },
        "revision": {
          "anyOf": [
            {
              "type": "null"
            },
            {
              "$ref": "#/$defs/text"
            }
          ]
        },
        "scope": {
          "anyOf": [
            {
              "const": "whole-repository"
            },
            {
              "type": "array",
              "minItems": 1,
              "uniqueItems": true,
              "items": {
                "$ref": "#/$defs/text"
              }
            }
          ]
        },
        "authorization": {
          "$ref": "#/$defs/text"
        },
        "output_location": {
          "$ref": "#/$defs/text"
        },
        "source": {
          "const": "analysed-record"
        },
        "inputs": {
          "$ref": "#/$defs/textList"
        },
        "tools": {
          "$ref": "#/$defs/text"
        },
        "evidence": {
          "$ref": "#/$defs/text"
        },
        "assumptions": {
          "$ref": "#/$defs/textList"
        },
        "coverage_gaps": {
          "$ref": "#/$defs/textList"
        },
        "next_action": {
          "$ref": "#/$defs/text"
        }
      },
      "required": [
        "record_version",
        "stage",
        "status",
        "run_id",
        "timestamp",
        "actor",
        "model",
        "skill_version",
        "target_id",
        "target_kind",
        "version",
        "revision",
        "scope",
        "authorization",
        "output_location",
        "source",
        "inputs",
        "tools",
        "evidence",
        "assumptions",
        "coverage_gaps",
        "next_action"
      ],
      "additionalProperties": false
    },
    "gate": {
      "type": "object",
      "properties": {
        "gate": {
          "$ref": "#/$defs/text"
        },
        "result": {
          "enum": [
            "pass",
            "fail",
            "unknown"
          ]
        }
      },
      "required": [
        "gate",
        "result"
      ],
      "additionalProperties": false
    },
    "patch": {
      "type": "object",
      "properties": {
        "id": {
          "type": "string",
          "pattern": "^PP-[1-9][0-9]*$"
        },
        "analysis_id": {
          "type": "string",
          "pattern": "^AP-[1-9][0-9]*$"
        },
        "finding_id": {
          "type": "string",
          "pattern": "^FD-[1-9][0-9]*$"
        },
        "finding_key": {
          "type": "string",
          "pattern": "^[a-z0-9][a-z0-9._-]*$"
        },
        "finding_fingerprint": {
          "anyOf": [
            {
              "type": "null"
            },
            {
              "type": "string",
              "pattern": "^fp:[0-9a-f]{16}$"
            }
          ]
        },
        "title": {
          "$ref": "#/$defs/text"
        },
        "severity": {
          "enum": [
            "critical",
            "high",
            "medium",
            "low"
          ]
        },
        "priority": {
          "enum": [
            "P0",
            "P1",
            "P2",
            "P3"
          ]
        },
        "outcome": {
          "enum": [
            "fixed",
            "no_change",
            "blocked",
            "inconclusive"
          ]
        },
        "locations": {
          "type": "array",
          "minItems": 1,
          "items": {
            "$ref": "#/$defs/location"
          }
        },
        "vulnerable_path": {
          "$ref": "#/$defs/text"
        },
        "security_invariant": {
          "$ref": "#/$defs/text"
        },
        "patch_strategy": {
          "$ref": "#/$defs/text"
        },
        "patch_ref": {
          "description": "Relative path to the unified diff under patches/; null when no patch was written (no_change or blocked).",
          "anyOf": [
            {
              "type": "null"
            },
            {
              "$ref": "#/$defs/text"
            }
          ]
        },
        "files_changed": {
          "$ref": "#/$defs/textList"
        },
        "tests_added": {
          "$ref": "#/$defs/textList"
        },
        "gates": {
          "type": "array",
          "items": {
            "$ref": "#/$defs/gate"
          }
        },
        "reproduction_before": {
          "$ref": "#/$defs/text"
        },
        "reproduction_after": {
          "$ref": "#/$defs/text"
        },
        "legitimate_behavior": {
          "$ref": "#/$defs/text"
        },
        "candidate_review": {
          "$ref": "#/$defs/text"
        },
        "remaining_risk": {
          "$ref": "#/$defs/text"
        },
        "proof_gap": {
          "$ref": "#/$defs/text"
        },
        "confidence": {
          "type": "object",
          "properties": {
            "level": {
              "enum": [
                "High",
                "Medium",
                "Low"
              ]
            },
            "reason": {
              "$ref": "#/$defs/text"
            }
          },
          "required": [
            "level",
            "reason"
          ],
          "additionalProperties": false
        },
        "artifacts": {
          "$ref": "#/$defs/textList"
        }
      },
      "required": [
        "analysis_id",
        "finding_id",
        "finding_key",
        "title",
        "severity",
        "priority",
        "outcome",
        "locations",
        "vulnerable_path",
        "security_invariant",
        "patch_strategy",
        "patch_ref",
        "files_changed",
        "tests_added",
        "gates",
        "reproduction_before",
        "reproduction_after",
        "legitimate_behavior",
        "candidate_review",
        "remaining_risk",
        "confidence"
      ],
      "additionalProperties": false
    },
    "notEligible": {
      "type": "object",
      "properties": {
        "analysis_id": {
          "type": "string",
          "pattern": "^AP-[1-9][0-9]*$"
        },
        "finding_id": {
          "type": "string",
          "pattern": "^FD-[1-9][0-9]*$"
        },
        "decision": {
          "enum": [
            "deferred",
            "ignore"
          ]
        },
        "reason": {
          "$ref": "#/$defs/text"
        }
      },
      "required": [
        "analysis_id",
        "finding_id",
        "decision",
        "reason"
      ],
      "additionalProperties": false
    }
  }
}
